{
  "file": "T-factor-4000001-5000000.parquet",
  "table": "factor",
  "range_start": 4000001,
  "range_end": 5000000,
  "row_count": 1000000,
  "columns": [
    {
      "name": "n",
      "type": "int64",
      "nullable": false
    },
    {
      "name": "prime_factors",
      "type": "uint64[]",
      "nullable": false
    },
    {
      "name": "smallest_prime_factor",
      "type": "uint64",
      "nullable": false
    },
    {
      "name": "largest_prime_factor",
      "type": "uint64",
      "nullable": false
    },
    {
      "name": "radical",
      "type": "uint64",
      "nullable": false
    },
    {
      "name": "omega_distinct",
      "type": "uint16",
      "nullable": false
    },
    {
      "name": "omega_big",
      "type": "uint16",
      "nullable": false
    },
    {
      "name": "euler_phi",
      "type": "uint64",
      "nullable": false
    },
    {
      "name": "mobius",
      "type": "int8",
      "nullable": false
    },
    {
      "name": "liouville_lambda",
      "type": "int8",
      "nullable": false
    },
    {
      "name": "von_mangoldt",
      "type": "double",
      "nullable": false
    },
    {
      "name": "is_prime",
      "type": "bool",
      "nullable": false
    },
    {
      "name": "is_prime_power",
      "type": "bool",
      "nullable": false
    },
    {
      "name": "is_squarefree",
      "type": "bool",
      "nullable": false
    },
    {
      "name": "is_powerful",
      "type": "bool",
      "nullable": false
    },
    {
      "name": "divisor_count",
      "type": "uint32",
      "nullable": false
    },
    {
      "name": "divisor_sum",
      "type": "uint64",
      "nullable": false
    },
    {
      "name": "aliquot_sum",
      "type": "uint64",
      "nullable": false
    },
    {
      "name": "abundancy_index",
      "type": "double",
      "nullable": false
    },
    {
      "name": "abundance_class",
      "type": "string",
      "nullable": false
    },
    {
      "name": "is_perfect",
      "type": "bool",
      "nullable": false
    },
    {
      "name": "is_practical",
      "type": "bool",
      "nullable": false
    },
    {
      "name": "carmichael_lambda",
      "type": "uint64",
      "nullable": false
    },
    {
      "name": "gcd_sum_pillai",
      "type": "uint64",
      "nullable": false
    },
    {
      "name": "sum_of_two_squares_count",
      "type": "uint32",
      "nullable": false
    }
  ],
  "format": "parquet",
  "compression": "zstd",
  "algorithm_release": "algos-0.2.2",
  "generated_at_utc": "2026-06-22T20:48:41Z",
  "hashes": {
    "sha256": "b6ddf65e42439a08c792a240778f6eb405f2ebdbf4a4929f7cc94b3ff6088dc5",
    "sha512": "640a8e9e32e3ea76fe64c8f4805597b494e941fc7151221100390528a5176357534f902711484975ce8275ceacbb95fe0ea5f1448c4d6f7978cde3657ae110ea",
    "blake3": "fd003b416e90660be1417ee4d8c6a312cc16218f93690706272d6930accedead"
  },
  "storage": [
    "https://files.integer-atlas.com/T-factor-4000001-5000000.parquet"
  ],
  "verification": {
    "status": "accepted"
  },
  "author": "outcompute",
  "license": "CC0-1.0"
}
