{
  "file": "T-core-6000001-7000000.parquet",
  "table": "core",
  "range_start": 6000001,
  "range_end": 7000000,
  "row_count": 1000000,
  "columns": [
    {
      "name": "n",
      "type": "int64",
      "nullable": false
    },
    {
      "name": "abs_n",
      "type": "uint64",
      "nullable": false
    },
    {
      "name": "sign",
      "type": "int8",
      "nullable": false
    },
    {
      "name": "is_even",
      "type": "bool",
      "nullable": false
    },
    {
      "name": "is_odd",
      "type": "bool",
      "nullable": false
    },
    {
      "name": "bit_length",
      "type": "uint16",
      "nullable": false
    },
    {
      "name": "dyadic_valuation",
      "type": "uint16",
      "nullable": false
    },
    {
      "name": "integer_sqrt",
      "type": "uint64",
      "nullable": false
    },
    {
      "name": "is_square",
      "type": "bool",
      "nullable": false
    },
    {
      "name": "is_triangular",
      "type": "bool",
      "nullable": false
    },
    {
      "name": "is_fibonacci",
      "type": "bool",
      "nullable": false
    },
    {
      "name": "is_perfect_power",
      "type": "bool",
      "nullable": false
    },
    {
      "name": "digital_root",
      "type": "uint8",
      "nullable": false
    },
    {
      "name": "decimal_digit_count",
      "type": "uint16",
      "nullable": false
    },
    {
      "name": "digit_sum",
      "type": "uint32",
      "nullable": false
    },
    {
      "name": "is_harshad",
      "type": "bool",
      "nullable": false
    },
    {
      "name": "is_palindrome",
      "type": "bool",
      "nullable": false
    },
    {
      "name": "binary_popcount",
      "type": "uint16",
      "nullable": false
    },
    {
      "name": "is_happy",
      "type": "bool",
      "nullable": false
    },
    {
      "name": "collatz_stopping_time",
      "type": "uint32",
      "nullable": false
    }
  ],
  "format": "parquet",
  "compression": "zstd",
  "algorithm_release": "algos-0.2.2",
  "generated_at_utc": "2026-06-22T20:17:05Z",
  "hashes": {
    "sha256": "dd7c8bddac58f68c4b88fa90cccbefc567a5de9e24a39e8b0c198bf53e7c598e",
    "sha512": "db90a26d9e27ce6a39ff3ccdf948136d37a1c9d35c340ee757d928c284b7547c413bebece369da29ba7496f9edb40ec21f3b2e6c8474deea2772c7f7724ded4f",
    "blake3": "07d3b96559573e4c02ef5298ff77f8a6759fadd8ecb64fa072bd2cc84bdd7f18"
  },
  "storage": [
    "https://files.integer-atlas.com/T-core-6000001-7000000.parquet"
  ],
  "verification": {
    "status": "accepted"
  },
  "author": "outcompute",
  "license": "CC0-1.0"
}
