{
  "file": "T-repr-1000001-2000000.parquet",
  "table": "repr",
  "range_start": 1000001,
  "range_end": 2000000,
  "row_count": 1000000,
  "columns": [
    {
      "name": "n",
      "type": "int64",
      "nullable": false
    },
    {
      "name": "binary_repr",
      "type": "string",
      "nullable": false
    },
    {
      "name": "octal_repr",
      "type": "string",
      "nullable": false
    },
    {
      "name": "hex_repr",
      "type": "string",
      "nullable": false
    }
  ],
  "format": "parquet",
  "compression": "zstd",
  "algorithm_release": "algos-0.2.2",
  "generated_at_utc": "2026-06-22T20:34:34Z",
  "hashes": {
    "sha256": "2580372266a7225c617e8186b6f36ebf06c391cfd2cfb7d394f2f09ef61b3f76",
    "sha512": "4a50b0e1e87fbc77e83f4e8f8f04ea971a839574d040251eaa95525491039b9a69bf06fd1cd55459839707ebeda019f9dcd823f1124de29aa1d2e729b57b75c7",
    "blake3": "74f8ea77173c3f9a712fd10e48b68aab38198a22e7a24cc42d7ca7fea8217833"
  },
  "storage": [
    "https://files.integer-atlas.com/T-repr-1000001-2000000.parquet"
  ],
  "verification": {
    "status": "accepted"
  },
  "author": "outcompute",
  "license": "CC0-1.0"
}
